{
  "category": "Police Procedural",
  "story_kind": "Internal-affairs whodunit with mentor-betrayal and conspiracy takedown.",
  "audience_delight": "Layered-corruption reveals, loyalty-vs-duty choice, cat-and-mouse pursuit, leadership cover-up exposure, justice-against-odds ending.",
  "metadata": {
    "project_id": "full_e2e_test_novel_20250821_105454",
    "step": 0,
    "version": "1.0.0",
    "created_at": "2025-08-21T10:55:19.906020",
    "model_name": "gpt-5",
    "temperature": 1.0,
    "seed": 42,
    "prompt_hash": "faa09707d8d06ed0977f70d02de2e6f9534eb2921e2ddf4434f0720342cc307a",
    "validator_version": "1.0.0"
  }
}