{
  "category": "Hard-Boiled Mystery",
  "story_kind": "Hard-boiled whodunit about a whistleblower detective versus a department cover-up.",
  "audience_delight": "Betrayal-twist, planted-evidence puzzle, internal-affairs forced-proximity, slow-burn pressure, redemption-arc.",
  "metadata": {
    "project_id": "monitored_e2e_test_novel_20250821_112421",
    "step": 0,
    "version": "1.0.0",
    "created_at": "2025-08-21T11:26:47.675404",
    "model_name": "gpt-5",
    "temperature": 1.0,
    "seed": 42,
    "prompt_hash": "8f10eef40d10489702e474633ac3a5fbae583de65a0aa69adf65c86da5530edf",
    "validator_version": "1.0.0"
  }
}