{
  "category": "Dystopian",
  "story_kind": "Conspiracy thriller heist about a rogue records auditor exposing a regime-wide cover-up.",
  "audience_delight": "Delivers a blackout heist, hacked surveillance feed twist, banned-history archive reveal, double-agent unmasking, and a rooftop chase finale.",
  "metadata": {
    "project_id": "full_e2e_test_novel_20250821_110957",
    "step": 0,
    "version": "1.0.0",
    "created_at": "2025-08-21T11:17:19.895506",
    "model_name": "gpt-5",
    "temperature": 1.0,
    "seed": 42,
    "prompt_hash": "faa09707d8d06ed0977f70d02de2e6f9534eb2921e2ddf4434f0720342cc307a",
    "validator_version": "1.0.0"
  }
}