{
  "category": "Dystopian",
  "story_kind": "A found-family heist against a life-harvesting regime with a redemption arc.",
  "audience_delight": "betrayal-twist, slow-burn, forced-proximity, puzzle, redemption-arc",
  "metadata": {
    "project_id": "the_immortality_tax_20250821_161814",
    "step": 0,
    "version": "1.0.0",
    "created_at": "2025-08-21T16:19:29.338627",
    "model_name": "gpt-5",
    "temperature": 1.0,
    "seed": 42,
    "prompt_hash": "2ecffc01bedd977a0facf1c097899cc6c2df46a8efa0cdb8afd7a8daccc1f727",
    "validator_version": "1.0.0"
  }
}