{
  "category": "Techno-Thriller",
  "story_kind": "Conspiracy whistleblower hunt with mentor-betrayal and cat-and-mouse inside a corrupt police tech unit.",
  "audience_delight": "Bodycam tampering clue, planted evidence reveal, mentor-betrayal twist, cat-and-mouse pursuit, public exposure climax.",
  "metadata": {
    "project_id": "full_e2e_test_novel_20250821_010500",
    "step": 0,
    "version": "1.0.0",
    "created_at": "2025-08-21T01:06:19.959253",
    "model_name": "gpt-5",
    "temperature": 1.0,
    "seed": 42,
    "prompt_hash": "faa09707d8d06ed0977f70d02de2e6f9534eb2921e2ddf4434f0720342cc307a",
    "validator_version": "1.0.0"
  }
}