{
  "category": "Police Procedural",
  "story_kind": "Whodunit with conspiracy cover-up and mentor-betrayal.",
  "audience_delight": "betrayal-twist, planted-evidence reveal, puzzle, slow-burn, redemption-arc.",
  "metadata": {
    "project_id": "full_e2e_test_novel_20250821_110503",
    "step": 0,
    "version": "1.0.0",
    "created_at": "2025-08-21T11:05:47.611776",
    "model_name": "gpt-5",
    "temperature": 1.0,
    "seed": 42,
    "prompt_hash": "faa09707d8d06ed0977f70d02de2e6f9534eb2921e2ddf4434f0720342cc307a",
    "validator_version": "1.0.0"
  }
}