{
  "category": "Police Procedural",
  "story_kind": "Conspiracy whodunit with an underdog whistleblower and cat-and-mouse between an IA detective and dirty cops.",
  "audience_delight": "Delivers betrayal-twist, puzzle, slow-burn, forced-proximity, redemption-arc.",
  "metadata": {
    "project_id": "monitored_e2e_test_novel_20250821_154550",
    "step": 0,
    "version": "1.0.0",
    "created_at": "2025-08-21T15:46:28.781336",
    "model_name": "gpt-5",
    "temperature": 1.0,
    "seed": 42,
    "prompt_hash": "8f10eef40d10489702e474633ac3a5fbae583de65a0aa69adf65c86da5530edf",
    "validator_version": "1.0.0"
  }
}