{
  "category": "Action Adventure",
  "story_kind": "Manhunt thriller with mentor-betrayal and cat-and-mouse.",
  "audience_delight": "Breakneck chases, layered corruption reveals, tough moral choices, authority-betrayal twist, justice-against-odds payoff.",
  "metadata": {
    "project_id": "full_e2e_test_novel_20250821_005322",
    "step": 0,
    "version": "1.0.0",
    "created_at": "2025-08-21T00:54:22.598847",
    "model_name": "gpt-5",
    "temperature": 1.0,
    "seed": 42,
    "prompt_hash": "faa09707d8d06ed0977f70d02de2e6f9534eb2921e2ddf4434f0720342cc307a",
    "validator_version": "1.0.0"
  }
}